[
  {
    "initial": "proposed",
    "name": "ActionCase",
    "notes": "open = proposed, awaiting-approval, approved, blocked. Terminal Cases never reopen; changes produce new Cases. Cancelling a committed action is a new compensating action, not history rewrite.",
    "owner": "Ontology",
    "states": [
      "proposed",
      "awaiting-approval",
      "approved",
      "blocked",
      "committed",
      "rejected",
      "expired",
      "stale",
      "cancelled"
    ],
    "transitions": [
      {
        "atomic_effect": "Pin Case digest/expiry and approval requirements",
        "event": "request-approval",
        "from": "proposed",
        "guard": "Released action, complete consequences and read guards",
        "to": "awaiting-approval"
      },
      {
        "atomic_effect": "Record response; return CaseProgress, no decision commit",
        "event": "record-approval",
        "from": "awaiting-approval",
        "guard": "Fresh authorized responder; quorum incomplete",
        "to": "awaiting-approval"
      },
      {
        "atomic_effect": "Record final response and approval state",
        "event": "satisfy-quorum",
        "from": "awaiting-approval",
        "guard": "Exact Case digest; current approval policy",
        "to": "approved"
      },
      {
        "atomic_effect": "One DecisionReceipt, semantic changes, reservations, EffectIntents and outbox",
        "event": "commit",
        "from": "approved",
        "guard": "Current authority, head/complete read guards, budget and expiry valid",
        "to": "committed"
      },
      {
        "atomic_effect": "Record nonterminal cause; no effect dispatch",
        "event": "resource-unavailable",
        "from": "approved",
        "guard": "No external effect escaped; required resource unavailable",
        "to": "blocked"
      },
      {
        "atomic_effect": "Clear temporary block; otherwise return stale",
        "event": "resume",
        "from": "blocked",
        "guard": "Same consent and all dependencies remain valid",
        "to": "approved"
      },
      {
        "atomic_effect": "Terminalize consent; require a new Case",
        "event": "dependency-change",
        "from": "*open",
        "guard": "Relevant guard no longer valid",
        "to": "stale"
      },
      {
        "atomic_effect": "Record rejection, release unescaped reservations",
        "event": "reject",
        "from": "*open",
        "guard": "Authorized approver rejects under policy",
        "to": "rejected"
      },
      {
        "atomic_effect": "No commit; expire unescaped preparation",
        "event": "expire",
        "from": "*open",
        "guard": "Bound clock exceeds expiry",
        "to": "expired"
      },
      {
        "atomic_effect": "Record cancellation; no escaped-effect claim",
        "event": "cancel",
        "from": "*open",
        "guard": "Authorized cancellation before local commit",
        "to": "cancelled"
      }
    ]
  },
  {
    "initial": "admitted",
    "name": "EveTurn",
    "notes": "open excludes settled/aborted. Token inference may repeat after failure; exactly one settled turn is enforced, not exactly-once model inference. Do not store private chain-of-thought.",
    "owner": "Eve",
    "states": [
      "admitted",
      "running",
      "waiting-tool",
      "waiting-user",
      "retryable",
      "settled",
      "aborted"
    ],
    "transitions": [
      {
        "atomic_effect": "Record owner token, fence and attempt",
        "event": "claim",
        "from": "admitted",
        "guard": "Owner lease/fence acquired",
        "to": "running"
      },
      {
        "atomic_effect": "Persist tool intent/operation ID before invocation",
        "event": "tool-proposal",
        "from": "running",
        "guard": "Released inspect/propose tool; authority checked independently",
        "to": "waiting-tool"
      },
      {
        "atomic_effect": "Record authorized result reference once",
        "event": "observe-result",
        "from": "waiting-tool",
        "guard": "Same tool operation; current turn fence",
        "to": "running"
      },
      {
        "atomic_effect": "Settle visible question fragment and wait binding",
        "event": "ask",
        "from": "running",
        "guard": "Question bound to subject/scope; fresh disclosure",
        "to": "waiting-user"
      },
      {
        "atomic_effect": "Admit attributed reply; no implicit global correction",
        "event": "reply",
        "from": "waiting-user",
        "guard": "Valid reply binding; new current fence",
        "to": "running"
      },
      {
        "atomic_effect": "Record recoverable attempt and checkpoint",
        "event": "recoverable-failure",
        "from": "running",
        "guard": "No settled terminal response",
        "to": "retryable"
      },
      {
        "atomic_effect": "Resume from journal without duplicate committed tool operation",
        "event": "claim",
        "from": "retryable",
        "guard": "New owner fence",
        "to": "running"
      },
      {
        "atomic_effect": "One settled visible response and delivery intent",
        "event": "settle",
        "from": "running",
        "guard": "Fence current; final authorized content ready",
        "to": "settled"
      },
      {
        "atomic_effect": "Stop future composition/tools; retain lawful history",
        "event": "abort",
        "from": "*open",
        "guard": "User cancellation/security deny",
        "to": "aborted"
      }
    ]
  },
  {
    "initial": "draft",
    "name": "DefinitionChange",
    "notes": "open excludes activated/rejected/stale. A live forward repair is another change; no blind head reversal. For supported lower-risk changes approval policy may pre-authorize, but current policy still controls it.",
    "owner": "Ontology",
    "states": [
      "draft",
      "validated",
      "evaluated",
      "prepared",
      "approved",
      "activated",
      "rejected",
      "stale"
    ],
    "transitions": [
      {
        "atomic_effect": "Pin canonical candidate digest",
        "event": "validate",
        "from": "draft",
        "guard": "Closed grammar, references, limits and current-policy risk classification pass",
        "to": "validated"
      },
      {
        "atomic_effect": "Record proof checks and missing attestations honestly",
        "event": "evaluate",
        "from": "validated",
        "guard": "Exact candidate/image in isolated evaluation realm",
        "to": "evaluated"
      },
      {
        "atomic_effect": "Pin prepared generation and open-work disposition",
        "event": "prepare",
        "from": "evaluated",
        "guard": "Target World generation ready through exact committed cut",
        "to": "prepared"
      },
      {
        "atomic_effect": "Record digest-bound approval",
        "event": "approve",
        "from": "prepared",
        "guard": "Approvers authorized under currently active policy",
        "to": "approved"
      },
      {
        "atomic_effect": "Switch head/generation atomically; receipt and outbox",
        "event": "activate",
        "from": "approved",
        "guard": "Exclusive head lock; exact expected head/cut; all proof/approval gates",
        "to": "activated"
      },
      {
        "atomic_effect": "Retain candidate/proof history; no activation",
        "event": "reject",
        "from": "*open",
        "guard": "Authorized explicit rejection",
        "to": "rejected"
      },
      {
        "atomic_effect": "Block activation; new preparation/review required",
        "event": "basis-changed",
        "from": "*open",
        "guard": "Digest/head/cut/proof no longer matches",
        "to": "stale"
      },
      {
        "atomic_effect": "Create successor candidate; old proof remains immutable",
        "event": "rebase",
        "from": "stale",
        "guard": "New change revision, conflict review",
        "to": "draft"
      }
    ]
  },
  {
    "initial": "staging",
    "name": "SourceCapture",
    "notes": "Re-admission of identical source/mapping returns same authorized receipt. Missing rows after a failed fetch are not source deletions.",
    "owner": "Ontology",
    "states": [
      "staging",
      "staged",
      "quarantined",
      "admitted",
      "expired",
      "erased"
    ],
    "transitions": [
      {
        "atomic_effect": "Record immutable capture identity",
        "event": "verify-upload",
        "from": "staging",
        "guard": "Durable bytes, digest, declared limits and rights metadata",
        "to": "staged"
      },
      {
        "atomic_effect": "Record reason, no claims",
        "event": "reject-upload",
        "from": "staging",
        "guard": "Incomplete/unsafe/unsupported bytes",
        "to": "quarantined"
      },
      {
        "atomic_effect": "Evidence, claims, receipt and outbox commit together",
        "event": "admit",
        "from": "staged",
        "guard": "Current binding/mapping/rights and unique source revision",
        "to": "admitted"
      },
      {
        "atomic_effect": "Keep raw attribution; no guessed facts",
        "event": "reject-mapping",
        "from": "staged",
        "guard": "Schema drift or incomparable source interpretation",
        "to": "quarantined"
      },
      {
        "atomic_effect": "Garbage collect with lock/recheck",
        "event": "expire-orphan",
        "from": "staged",
        "guard": "No evidence/pin/pending admission and expired upload lease",
        "to": "expired"
      },
      {
        "atomic_effect": "Suppress content and derivatives; retain permitted non-content audit",
        "event": "erase",
        "from": "admitted",
        "guard": "Current retention/hold/deletion policy and authorized receipt",
        "to": "erased"
      }
    ]
  },
  {
    "initial": "prepared",
    "name": "EffectAttempt",